{
  "$schema": "../../../schemas/drink.schema.json",
  "kind": "drink",
  "title": { "en": "Negroni", "nl": "Negroni" },
  "summary": {
    "en": "Equal parts gin, Campari and sweet vermouth, stirred cold and poured over one big cube. Bitter, sweet and done in a minute.",
    "nl": "Gelijke delen gin, Campari en zoete vermout, koud geroerd en geschonken over één groot ijsblok. Bitter, zoet en in een minuut klaar."
  },
  "servings": 1,
  "method": "stirred",
  "glass": "rocks",
  "ice": "large-cube",
  "tags": [
    { "en": "bitter", "nl": "bitter" },
    { "en": "aperitif", "nl": "aperitief" },
    { "en": "gin", "nl": "gin" }
  ],
  "ingredients": [
    { "id": "gin", "bottle": true, "name": { "en": "gin", "nl": "gin" }, "amount": 3, "unit": "cl", "note": { "en": "London dry", "nl": "London dry" } },
    { "id": "campari", "bottle": true, "name": { "en": "Campari", "nl": "Campari" }, "amount": 3, "unit": "cl" },
    { "id": "vermouth", "bottle": true, "name": { "en": "sweet vermouth", "nl": "zoete vermout" }, "amount": 3, "unit": "cl", "note": { "en": "kept in the fridge", "nl": "bewaard in de koelkast" } },
    { "id": "orange", "garnish": true, "name": { "en": "orange", "nl": "sinaasappel" }, "plural": { "en": "oranges", "nl": "sinaasappels" }, "amount": 1, "unit": "piece", "note": { "en": "a wide strip of peel", "nl": "een brede reep schil" } }
  ],
  "steps": [
    {
      "text": {
        "en": "Put one large ice cube in the rocks glass and set it in the freezer while you mix.",
        "nl": "Leg één groot ijsblok in de tumbler en zet hem in de vriezer terwijl je mixt."
      }
    },
    {
      "text": {
        "en": "Pour the gin, Campari and vermouth into a mixing glass and [[stir|stir]] with ice until very cold.",
        "nl": "Schenk de gin, Campari en vermout in een mengglas en [[roer|stir]] met ijs tot het ijskoud is."
      },
      "ingredients": ["gin", "campari", "vermouth"],
      "tip": {
        "en": "Taste from the spoon: when the edge of the Campari has softened, it is diluted enough.",
        "nl": "Proef van de lepel: als de scherpte van de Campari zachter is geworden, is hij genoeg verdund."
      }
    },
    {
      "text": {
        "en": "Strain over the cube in the cold glass.",
        "nl": "Zeef over het ijsblok in het koude glas."
      }
    },
    {
      "text": {
        "en": "Cut a wide strip of orange peel, [[express it|express-peel]] over the drink and drop it in.",
        "nl": "Snijd een brede reep sinaasappelschil, [[knijp hem uit|express-peel]] boven de drank en laat hem erin vallen."
      },
      "ingredients": ["orange"]
    }
  ]
}
