{
  "$schema": "../../../schemas/drink.schema.json",
  "kind": "drink",
  "title": { "en": "Whisky sour", "nl": "Whisky sour" },
  "summary": {
    "en": "Bourbon, lemon and sugar shaken twice for a thick white foam, with a few drops of bitters on top.",
    "nl": "Bourbon, citroen en suiker, twee keer geshaket voor een dikke witte schuimkraag, met een paar druppels bitter erop."
  },
  "servings": 1,
  "method": "shaken",
  "glass": "rocks",
  "ice": "cubes",
  "tags": [
    { "en": "sour", "nl": "zuur" },
    { "en": "whisky", "nl": "whisky" }
  ],
  "ingredients": [
    { "id": "bourbon", "bottle": true, "name": { "en": "bourbon", "nl": "bourbon" }, "amount": 5, "unit": "cl" },
    { "id": "lemon", "name": { "en": "lemon", "nl": "citroen" }, "plural": { "en": "lemons", "nl": "citroenen" }, "amount": 0.5, "unit": "piece", "note": { "en": "freshly squeezed, about 2.5 cl", "nl": "vers geperst, ongeveer 2,5 cl" } },
    { "id": "syrup", "name": { "en": "sugar syrup", "nl": "suikersiroop" }, "amount": 2, "unit": "cl", "note": { "en": "equal parts sugar and water", "nl": "gelijke delen suiker en water" } },
    { "id": "egg", "name": { "en": "egg", "nl": "ei" }, "plural": { "en": "eggs", "nl": "eieren" }, "amount": 1, "unit": "piece", "note": { "en": "only the white", "nl": "alleen het eiwit" } },
    { "id": "bitters", "bottle": true, "garnish": true, "name": { "en": "Angostura bitters", "nl": "Angostura bitter" }, "amount": 3, "unit": "dash" }
  ],
  "steps": [
    {
      "text": {
        "en": "Fill the rocks glass with ice cubes to chill it.",
        "nl": "Vul de tumbler met ijsblokjes om hem koud te maken."
      }
    },
    {
      "text": {
        "en": "Put the bourbon, lemon juice, syrup and egg white in the shaker and [[dry shake|dry-shake]] it.",
        "nl": "Doe de bourbon, het citroensap, de siroop en het eiwit in de shaker en [[shake droog|dry-shake]]."
      },
      "ingredients": ["bourbon", "lemon", "syrup", "egg"]
    },
    {
      "text": {
        "en": "Add ice and [[shake|shake]] again.",
        "nl": "Voeg ijs toe en [[shake|shake]] nog een keer."
      },
      "tip": {
        "en": "Hold the lid on with your palm: without ice, the shaker can pop open.",
        "nl": "Houd het deksel vast met je handpalm: zonder ijs kan de shaker openschieten."
      }
    },
    {
      "text": {
        "en": "Tip the ice out of the glass, add fresh cubes and [[double strain|double-strain]] the drink over them.",
        "nl": "Gooi het ijs uit het glas, doe er verse blokjes in en [[zeef de drank dubbel|double-strain]] erover."
      }
    },
    {
      "text": {
        "en": "Let the bitters fall onto the foam in a few drops.",
        "nl": "Laat de bitter in een paar druppels op het schuim vallen."
      },
      "ingredients": ["bitters"]
    }
  ]
}
